link_noticia;titulo;data_hora;tags
https://g1.globo.com/economia/noticia/2019/10/06/com-trabalho-por-conta-propria-em-nivel-recorde-numero-de-meis-ultrapassa-a-marca-de-9-milhoes.ghtml;Com trabalho por conta própria em nível recorde, número de MEIs ultrapassa a marca de 9 milhões; 06/10/2019 12h09 ;Economia
https://g1.globo.com/natureza/noticia/2019/10/06/papa-francisco-diz-que-amazonia-precisa-do-fogo-do-amor-e-nao-do-fogo-ateado-por-interesses-que-destroem.ghtml;Papa Francisco diz que Amazônia precisa do 'fogo do amor' e não do 'fogo ateado por interesses que destroem'; 06/10/2019 05h39 ; Papa Francisco 
https://g1.globo.com/economia/agronegocios/globo-rural/noticia/2019/10/06/produtores-rurais-do-para-tentam-manter-preservacao-na-amazonia-mas-crimes-ambientais-continuam.ghtml;Produtores rurais do Pará tentam manter preservação na Amazônia, mas crimes ambientais continuam; 06/10/2019 09h56 ; Embrapa 
https://g1.globo.com/pa/santarem-regiao/noticia/2019/10/06/incendio-florestal-atinge-parque-com-pinturas-rupestres-em-monte-alegre-no-para.ghtml;Incêndio florestal atinge parque com pinturas rupestres em Monte Alegre, no Pará ; 06/10/2019 10h37 ;Santarém e Região
https://g1.globo.com/pop-arte/musica/rock-in-rio/2019/noticia/2019/10/06/muse-e-imagine-dragons-fecham-rock-in-rio-2019-com-duas-atracoes-principais-neste-domingo.ghtml;Muse e Imagine Dragons fecham Rock in Rio 2019 com duas atrações principais neste domingo; 06/10/2019 06h00 ; Imagine Dragons 
https://g1.globo.com/pop-arte/musica/rock-in-rio/2019/noticia/2019/10/06/pink-acrobatica-anitta-em-dobro-e-funk-orquestrado-o-resumo-do-6o-dia-de-rock-in-rio.ghtml;Pink acrobática, Anitta em dobro e funk orquestrado: o resumo do 6º dia de Rock in Rio; 06/10/2019 01h48 ; Anitta 
https://g1.globo.com/pop-arte/musica/rock-in-rio/2019/noticia/2019/10/06/fas-de-imagine-dragons-que-nao-conseguirao-ir-ao-show-da-banda-no-rock-in-rio-geram-memes-e-lamentam.ghtml;Fãs de Imagine Dragons que não conseguirão ir ao show da banda no Rock in Rio geram memes e lamentam; 06/10/2019 11h24 ;Rock in Rio 2019
https://g1.globo.com/pop-arte/musica/rock-in-rio/2019/noticia/2019/10/06/em-cinco-dias-de-rock-in-rio-policia-civil-registrou-719-ocorrencias-durante-o-evento.ghtml;Em cinco dias de Rock in Rio, Polícia Civil registrou 719 ocorrências durante o evento; 06/10/2019 07h01 ;Rock in Rio 2019
https://g1.globo.com/pop-arte/musica/rock-in-rio/2019/noticia/2019/10/06/empresa-que-tinha-trabalhadores-dormindo-embaixo-do-palco-sunset-e-multada-em-r-30-mil.ghtml;Empresa que tinha trabalhadores dormindo embaixo do Palco Sunset é multada em R$ 30 mil; 06/10/2019 06h00 ;Rock in Rio 2019
